[
  {
    "id": "S1_FR_CONCEPT_001",
    "twin_id": "S1_EN_CONCEPT_001",
    "session": "S1",
    "session_title_en": "Introduction & Simple Linear Regression",
    "session_title_fr": "Introduction et régression linéaire simple",
    "language": "fr",
    "question_type": "CONCEPT",
    "difficulty": "EASY",
    "topics": [
      "data_types",
      "cross_section",
      "time_series",
      "panel_data"
    ],
    "prerequisites": [],
    "lecture_ref": "S1.1",
    "question_text": "Un chercheur recueille les ensembles de données suivants. Pour chacun, identifiez s'il s'agit d'une **coupe transversale**, d'une **série temporelle** ou de **données de panel**.\n\n1. Le taux de chômage des États-Unis, enregistré mensuellement de janvier 2000 à décembre 2023.\n2. Le revenu annuel, le niveau d'éducation et l'âge de 5{,}000 ménages différents interrogés une seule fois en 2023.\n3. Le PIB, le taux d'inflation et le taux de chômage de 30 pays de l'OCDE, observés chaque année de 1990 à 2020.\n\nJustifiez chaque réponse en une courte phrase.",
    "data_table": null,
    "solution": {
      "text": "1. **Série temporelle** : une seule entité (les États-Unis) est observée de façon répétée dans le temps (mensuellement, 2000-2023). La variation pertinente est dans le temps. 2. **Coupe transversale** : de nombreuses unités distinctes (5{,}000 ménages) sont chacune observées une seule fois à un moment donné (2023). La variation est entre les unités. 3. **Données de panel (longitudinales)** : le même ensemble d'unités (30 pays de l'OCDE) est observé de façon répétée dans le temps (annuellement, 1990-2020). L'ensemble de données possède à la fois une dimension d'unité et une dimension temporelle.",
      "key_formula": null,
      "numerical_answer": null,
      "common_mistakes": []
    },
    "hints": [
      "Indice 1 : Posez-vous deux questions pour chaque ensemble de données — combien d'unités distinctes sont observées, et combien de périodes temporelles sont observées ?",
      "Indice 2 : Une coupe transversale comporte plusieurs unités à un seul moment. Une série temporelle comporte une (ou un petit nombre d') unité(s) sur plusieurs périodes. Un panel comporte plusieurs unités ET plusieurs périodes."
    ],
    "related_exercises": []
  },
  {
    "id": "S1_FR_CONCEPT_002",
    "twin_id": "S1_EN_CONCEPT_002",
    "session": "S1",
    "session_title_en": "Introduction & Simple Linear Regression",
    "session_title_fr": "Introduction et régression linéaire simple",
    "language": "fr",
    "question_type": "CONCEPT",
    "difficulty": "EASY",
    "topics": [
      "correlation_vs_causation"
    ],
    "prerequisites": [],
    "lecture_ref": "S1.2",
    "question_text": "Un journal rapporte : *« Les villes ayant plus de pompiers ont tendance à connaître des incendies plus importants (mesurés en dommages matériels). Par conséquent, envoyer des pompiers sur un incendie aggrave celui-ci. »*\n\nExpliquez en 3 ou 4 phrases pourquoi cet argument est erroné. Dans votre réponse, distinguez clairement la **corrélation** de la **causalité**, et proposez une explication alternative plausible pour la corrélation positive observée.",
    "data_table": null,
    "solution": {
      "text": "L'argument confond corrélation et causalité. Les données montrent uniquement que le nombre de pompiers et la taille des incendies évoluent ensemble (corrélation), et non que l'un cause l'autre. Une explication alternative plausible est que les deux variables sont déterminées par un troisième facteur : la taille ou la gravité de l'incendie. Les grands incendies nécessitent plus de pompiers ET causent plus de dommages ; les petits incendies nécessitent peu de pompiers ET causent peu de dommages. La troisième variable (la taille de l'incendie) crée la corrélation positive, même si l'envoi de davantage de pompiers *réduit* probablement les dommages à taille d'incendie constante.",
      "key_formula": null,
      "numerical_answer": null,
      "common_mistakes": []
    },
    "hints": [
      "Indice 1 : Deux variables peuvent évoluer ensemble pour des raisons autres que l'une causant l'autre. Qu'est-ce qui pourrait expliquer le motif observé ?",
      "Indice 2 : Pensez à ce qui détermine À LA FOIS le nombre de pompiers dépêchés ET la taille de l'incendie. Existe-t-il un facteur commun ?"
    ],
    "related_exercises": [
      "S1_FR_CONCEPT_007"
    ]
  },
  {
    "id": "S1_FR_CONCEPT_003",
    "twin_id": "S1_EN_CONCEPT_003",
    "session": "S1",
    "session_title_en": "Introduction & Simple Linear Regression",
    "session_title_fr": "Introduction et régression linéaire simple",
    "language": "fr",
    "question_type": "CONCEPT",
    "difficulty": "EASY",
    "topics": [
      "SLR_model",
      "error_term"
    ],
    "prerequisites": [],
    "lecture_ref": "S1.3",
    "question_text": "Considérez le modèle de population de régression linéaire simple :\n\n$$y = \\beta_0 + \\beta_1 x + u.$$\n\nPour chacun des éléments suivants, indiquez en une phrase ce qu'il représente :\n\n(a) $y$\n(b) $x$\n(c) $\\beta_0$\n(d) $\\beta_1$\n(e) $u$\n\nEnsuite, expliquez en 1 ou 2 phrases pourquoi $u$ est nécessaire dans le modèle — c'est-à-dire ce qui serait perdu si l'on écrivait $y = \\beta_0 + \\beta_1 x$ exactement.",
    "data_table": null,
    "solution": {
      "text": "(a) $y$ est la **variable dépendante** (ou résultat / régressande) — la variable dont on veut expliquer la variation. (b) $x$ est la **variable explicative** (ou régresseur / variable indépendante) — la variable utilisée pour expliquer $y$. (c) $\\beta_0$ est l'**ordonnée à l'origine** : la valeur attendue de $y$ lorsque $x = 0$. (d) $\\beta_1$ est la **pente** : le changement attendu de $y$ associé à une augmentation d'une unité de $x$. (e) $u$ est le **terme d'erreur** (ou perturbation) : tout ce qui affecte $y$ mais qui n'est pas capté par $x$.\n\nLe terme d'erreur $u$ est nécessaire car, dans le monde réel, deux unités ayant le même $x$ n'ont jamais exactement le même $y$. $u$ regroupe les facteurs non observés, les variables omises, l'erreur de mesure et le caractère intrinsèquement aléatoire de la relation — sans lui, le modèle serait une droite déterministe qu'aucun ensemble de données réel ne satisferait exactement.",
      "key_formula": "$y = \\beta_0 + \\beta_1 x + u$",
      "numerical_answer": null,
      "common_mistakes": []
    },
    "hints": [
      "Indice 1 : Chaque lettre grecque et chaque variable du modèle de régression linéaire simple a un rôle spécifique : résultat, régresseur, ordonnée à l'origine, pente ou facteurs non observés.",
      "Indice 2 : Pensez à ce que le modèle prédirait si vous fixiez $x = 0$. Cela vous indique ce que signifie $\\beta_0$. Réfléchissez ensuite à la façon dont $y$ change lorsque $x$ change d'une unité — cela vous donne $\\beta_1$."
    ],
    "related_exercises": [
      "S1_FR_CONCEPT_004",
      "S1_FR_CONCEPT_005",
      "S1_FR_CONCEPT_006"
    ]
  },
  {
    "id": "S1_FR_CONCEPT_004",
    "twin_id": "S1_EN_CONCEPT_004",
    "session": "S1",
    "session_title_en": "Introduction & Simple Linear Regression",
    "session_title_fr": "Introduction et régression linéaire simple",
    "language": "fr",
    "question_type": "CONCEPT",
    "difficulty": "MED",
    "topics": [
      "beta_interpretation",
      "SLR_model"
    ],
    "prerequisites": [],
    "lecture_ref": "S1.4",
    "question_text": "Un économiste estime la régression linéaire simple suivante sur une coupe transversale de 1{,}200 travailleurs :\n\n$$\\widehat{\\text{salaire}} = 4{,}50 + 0{,}62 \\, \\text{educ},$$\n\noù $\\text{salaire}$ est le salaire horaire en dollars américains et $\\text{educ}$ est le nombre d'années d'éducation complétées.\n\n(a) Interprétez la pente estimée $\\hat\\beta_1 = 0{,}62$ en une phrase en utilisant le modèle d'interprétation standard.\n\n(b) Interprétez l'ordonnée à l'origine estimée $\\hat\\beta_0 = 4{,}50$. Cette interprétation est-elle économiquement pertinente dans cet ensemble de données ? Expliquez brièvement.",
    "data_table": null,
    "solution": {
      "text": "(a) Lorsque le nombre d'années d'éducation augmente de 1 année, le salaire horaire a tendance à être plus élevé de \\$0{,}62, en moyenne, toutes choses égales par ailleurs.\n\n(b) Mécaniquement, $\\hat\\beta_0 = 4{,}50$ est le salaire horaire prédit pour un travailleur ayant $\\text{educ} = 0$ année de scolarité. Dans cet ensemble de données, cette interprétation **n'est pas économiquement pertinente** : les travailleurs ayant littéralement zéro année d'éducation sont extrêmement rares (ou absents) dans un échantillon typique du marché du travail, donc $\\text{educ} = 0$ se situe en dehors de la plage des données. L'ordonnée à l'origine est plutôt à voir comme une constante d'ajustement qui ancre la droite de régression, et non comme une prédiction fiable.",
      "key_formula": "$\\widehat{y} = \\hat\\beta_0 + \\hat\\beta_1 x$",
      "numerical_answer": null,
      "common_mistakes": [
        "Dire « si l'éducation augmente de 1, le salaire augmente de 0,62 » sans les mots « en moyenne » ou « a tendance à » — cela exagère le contenu déterministe de la régression.",
        "Interpréter $\\hat\\beta_0 = 4{,}50$ comme une prédiction pertinente sans vérifier si $x = 0$ se trouve dans la plage des données."
      ]
    },
    "hints": [
      "Indice 1 : La pente répond à : « si $x$ augmente d'une unité, qu'arrive-t-il à $y$ en moyenne ? » L'ordonnée à l'origine répond à : « quel est le $y$ prédit lorsque $x = 0$ ? »",
      "Indice 2 : Pour l'ordonnée à l'origine, demandez-vous si $\\text{educ} = 0$ est une valeur plausible dans l'échantillon. Si ce n'est pas le cas, l'interprétation littérale de l'ordonnée à l'origine est une extrapolation."
    ],
    "related_exercises": [
      "S1_FR_CONCEPT_003",
      "S1_FR_CONCEPT_005",
      "S1_FR_CONCEPT_006"
    ]
  },
  {
    "id": "S1_FR_CONCEPT_005",
    "twin_id": "S1_EN_CONCEPT_005",
    "session": "S1",